{
  "schemaVersion": 1,
  "subject": {
    "transactionId": "906894532b971ecf8c4ac6fcdd3f7380e00549b2",
    "contributionId": "two-letter-output-covariance-curvature",
    "path": "problems/bssc-sum-capacity/contributions/two-letter-output-covariance-curvature"
  },
  "verifier": {
    "id": "python-stdlib-3-13-v1",
    "specDigest": "sha256:fc7ed06b77396fabc1da84694b4d8a08800843f41ad8ca4b9cd666b67ba60884",
    "implementation": "oci-command-v1"
  },
  "environment": {
    "kind": "oci",
    "image": "python@sha256:5f55cdf0c5d9dc1a415637a5ccc4a9e18663ad203673173b8cda8f8dcacef689",
    "platform": "linux/amd64",
    "network": "none",
    "readOnlyRoot": true,
    "user": "65534:65534",
    "capabilities": [],
    "noNewPrivileges": true,
    "memoryBytes": 536870912,
    "cpuCount": 1,
    "pidsLimit": 128,
    "tmpfsBytes": 67108864
  },
  "environmentDigest": "sha256:706bbc3e9afe2e838ceb1436a3246054d028cbdb86b33c8a21f5609584ca1e94",
  "requestDigest": "sha256:98ae53a762d548fdf98e8e0ef4950608675eca615366fa9057680812228c9ae0",
  "inputs": [
    {
      "path": "README.md",
      "digest": "sha256:60838ff19a5328d411bb4aa9f7c8bc78a2445d26bdf41a0740e2d08b2ad4a7bc",
      "bytes": 7402
    },
    {
      "path": "claims.json",
      "digest": "sha256:48cafb76a9fb8682784d85548ea8abb532ef28c4f496605a83227887b2b85998",
      "bytes": 981
    },
    {
      "path": "verification.json",
      "digest": "sha256:9764fcc6d169eaa82f04d483f6dec405c8df5eff3f9c94bcee3dd46a1ee40b69",
      "bytes": 221
    },
    {
      "path": "verify.py",
      "digest": "sha256:d76ac238ad4a54b7c6cbe365f63cba591210de2924186bb05d18314c17dbb33c",
      "bytes": 5630
    }
  ],
  "invocation": {
    "executable": "python3",
    "fixedArguments": [
      "-I",
      "-B"
    ],
    "entrypoint": "verify.py",
    "arguments": [],
    "timeoutSeconds": 300,
    "maximumOutputBytes": 262144,
    "successExitCodes": [
      0
    ]
  },
  "result": {
    "status": "passed",
    "exitCode": 0,
    "timedOut": false
  },
  "outputs": {
    "stdout": {
      "digest": "sha256:3ab810e0aee6b9e39363d20131a4e34195ad627f26224233bc494f53b06abf26",
      "bytes": 612
    },
    "stderr": {
      "digest": "sha256:a5afdd02855dd64005bc2df2ab78b76ffc38283fa7805cadd67d84c646cca830",
      "bytes": 948
    }
  },
  "producer": {
    "implementation": "math-flow-oci-attestation-producer-v1",
    "mathFlowVersion": "0.6.0"
  },
  "attestationId": "sha256:b6f5ddf46db8d3af735b4d997f0aa53e30b12750661d54116c75c28a9ca14e90"
}
