{
  "schemaVersion": 1,
  "subject": {
    "transactionId": "d2506be78c46f1799e9b54cfcb6eee17b984f0f1",
    "contributionId": "fixed-pair-upper-bound-attested",
    "path": "problems/bssc-sum-capacity/contributions/fixed-pair-upper-bound-attested"
  },
  "verifier": {
    "id": "python-stdlib-3-13-v1",
    "specDigest": "sha256:fc7ed06b77396fabc1da84694b4d8a08800843f41ad8ca4b9cd666b67ba60884",
    "implementation": "oci-command-v1"
  },
  "environment": {
    "kind": "oci",
    "image": "python@sha256:5f55cdf0c5d9dc1a415637a5ccc4a9e18663ad203673173b8cda8f8dcacef689",
    "platform": "linux/amd64",
    "network": "none",
    "readOnlyRoot": true,
    "user": "65534:65534",
    "capabilities": [],
    "noNewPrivileges": true,
    "memoryBytes": 536870912,
    "cpuCount": 1,
    "pidsLimit": 128,
    "tmpfsBytes": 67108864
  },
  "environmentDigest": "sha256:706bbc3e9afe2e838ceb1436a3246054d028cbdb86b33c8a21f5609584ca1e94",
  "requestDigest": "sha256:5e7a694cbea646543618ab37d56dce1c6d6d4fedff6f2c792294ffdc48018998",
  "inputs": [
    {
      "path": "README.md",
      "digest": "sha256:5ce661a9268de184e6b2f052345efbb0d5035d45cadfbeefd3f2b5ee7e763154",
      "bytes": 9264
    },
    {
      "path": "claims.json",
      "digest": "sha256:28f1c828179a36f2c4ebed29f71311cc64875d6b479f8d5ff0754c68abfa91d3",
      "bytes": 1204
    },
    {
      "path": "verification.json",
      "digest": "sha256:9764fcc6d169eaa82f04d483f6dec405c8df5eff3f9c94bcee3dd46a1ee40b69",
      "bytes": 221
    },
    {
      "path": "verify.py",
      "digest": "sha256:4f285603cd2617b34499b968a0f287a9dcf0c6d6020b7ee6613a5b7fc6fac881",
      "bytes": 13492
    }
  ],
  "invocation": {
    "executable": "python3",
    "fixedArguments": [
      "-I",
      "-B"
    ],
    "entrypoint": "verify.py",
    "arguments": [],
    "timeoutSeconds": 300,
    "maximumOutputBytes": 262144,
    "successExitCodes": [
      0
    ]
  },
  "result": {
    "status": "passed",
    "exitCode": 0,
    "timedOut": false
  },
  "outputs": {
    "stdout": {
      "digest": "sha256:416c6071757a563da64db30100d070af9e52793a69d241fccc8b3837172817c1",
      "bytes": 381
    },
    "stderr": {
      "digest": "sha256:fb02ef70822ffa9f90e27e7893fe14a543b2bf3cbadedab67cd4195946d4587f",
      "bytes": 915
    }
  },
  "producer": {
    "implementation": "math-flow-oci-attestation-producer-v1",
    "mathFlowVersion": "0.6.0"
  },
  "attestationId": "sha256:e0d849b94d74b20f3cf57318001759a474ff81d59223826c9fdd889e943d3e78"
}
